[
  {
    "id": "20000001-0000-4000-8000-000000000001",
    "siteId": "11111111-1111-4111-8111-111111111111",
    "code": "MB-2026-001",
    "lotId": "60000001-0000-4000-8000-000000000001",
    "volumeLiters": 0,
    "bottleCount": 0,
    "status": "planned",
    "createdAt": "2026-05-18T09:00:00.000Z",
    "updatedAt": "2026-05-18T09:00:00.000Z"
  }
]
